CODIGO EUROPEO,NOMBRE,CATEGORÍA,DIRECCIÓN,ENTIDAD MATRIZ,CODIGO DE SUPERVISOR
ES0241,"A&G BANCO, S.A.",Entidad de crédito,"Paseo de la Castellana, 92, 28046, Madrid",,241
ES2080,"Abanca Corporacion Bancaria, S.A.",Entidad de crédito,"CI Cantón Claudino Pita, 2, 15300, Betanzos",,2080
ES8620,"Abanca Servicios Financieros E.F.C., S.A.",Otra institución,"CL RÚA NUEVA, 30, 15004, A CORUÑA",,8620
ES1535,"AKF Bank GmbH & Co Kg, Sucursal en España",Entidad de crédito,"AV DE EUROPA, 12, 28108, ALCOBENDAS",DE03439,1535
ES0011,"Allfunds Bank, S.A.",Entidad de crédito,"Cl Padres Dominicos, 7, 28050, Madrid",,11
ES6730,ALPHA FX EUROPE LIMITED SUCURSAL EN ESPAÑA,Otra institución,"PS CASTELLANA, 53, 28046, MADRID",MTA213000,6730
ES0200,"ANDBANK ESPAÑA BANCA PRIVADA, S.A.",Entidad de crédito,"PS DE LA CASTELLANA, 55, 28046, MADRID",,200
ES0136,"Aresbank, S.A.",Entidad de crédito,"Ps de la Castellana, 257, 28046, Madrid",,136
ES3183,"Arquia Bank, S.A.",Entidad de crédito,"CL TUTOR, 16, 28008, MADRID",,3183
ES1541,"Attijariwafa Bank Europe, Sucursal en España",Entidad de crédito,"Cl Bravo Murillo, 210, 28020, Madrid",FR23890,1541
ES0061,"Banca March, S.A.",Entidad de crédito,"AV DE ALEJANDRO ROSELLÓ, 8, 07002, PALMA",,61
ES1550,"Banca Popolare Etica Società Cooperativa per Azioni, Sucursal en España",Entidad de crédito,"Cl Santa María, 9, 48005, Bilbao",IT0001210299538,1550
ES0078,"Banca Pueyo, S.A.",Entidad de crédito,"CL SANTA MARÍA DE GUADALUPE, 2, 06700, VILLANUEVA DE LA SERENA",,78
ES0188,"Banco Alcalá, S.A.",Entidad de crédito,"Cl José Ortega y Gasset, 7, 28006, Madrid",,188
ES0182,"Banco Bilbao Vizcaya Argentaria, S.A.",Entidad de crédito,"Pz de San Nicolás, 4, 48005, Bilbao",,182
ES0225,"Banco Cetelem, S.A.",Entidad de crédito,"PASEO DE LOS MELANCÓLICOS, 14, 28005, Madrid",,225
ES0198,"Banco Cooperativo Español, S.A.",Entidad de crédito,"Cl Virgen de los Peligros, 4, 28013, Madrid",,198
ES0091,"Banco de Albacete, S.A.",Entidad de crédito,"AV DE CANTABRIA, SN, 28660, BOADILLA DEL MONTE",,91
ES0240,Banco de Crédito Social Cooperativo,Entidad de crédito,"Pº Castellana, 87, 28046, Madrid",,240
ES0003,"Banco de Depósitos, S.A.",Entidad de crédito,"PS DE LA CASTELLANA, 120, 28046, MADRID",,3
ES9000,BANCO DE ESPAÑA,Banco central,"CL ALCALÁ, 48, 28014, Madrid",,9000
ES1569,"Banco de Investimento Global SA, Sucursal en España",Entidad de crédito,"CL SERRANO 67, 28006, MADRID",PT61,1569
ES0169,"Banco de la Nación Argentina, Sucursal en España",Entidad de crédito,"Cl Núñez de Balboa, 73, 28001, Madrid",AR0ECBM00012,169
ES0081,"Banco de Sabadell, S.A.",Entidad de crédito,"AV. ÓSCAR ESPLÁ, 30, 03003, ALICANTE/ALACANT",,81
ES0184,"Banco Europeo de Finanzas, S.A.",Entidad de crédito,"Cl Bolsa, 4, 29015, Málaga",,184
ES0220,"BANCO FINANTIA, S.A., SUCURSAL EN ESPAÑA",Entidad de crédito,"AV MENÉNDEZ PELAYO, 67, 28009, MADRID",PT48,220
ES0232,"Banco Inversis, S.A.",Entidad de crédito,"Av de la Hispanidad, 6, 28042, Madrid",,232
ES0186,"Banco Mediolanum, S.A.",Entidad de crédito,"CL BARCAS, 10, 46002, VALENCIA",,186
ES0121,"Banco Occidental, S.A.",Entidad de crédito,"Cl Azul, 4, 28050, Madrid",,121
ES0235,"Banco Pichincha España, S.A..",Entidad de crédito,"Cl Lagasca, 4, 28001, Madrid",,235
ES1509,"Banco Primus, S.A., Sucursal en España",Entidad de crédito,"Av del Partenón, 10, 28042, Madrid",PT246,1509
ES0049,"Banco Santander, S.A.",Entidad de crédito,"Ps de Pereda, 9-12, 39004, Santander",,49
ES8843,BANGE CREDIT E.F.C. SA,Otra institución,"CL SERRANO, 106, 28006, MADRID",,8843
ES1574,"Bank Julius Baer Europe, S.A, Sucursal en España",Entidad de crédito,"PS DE LA CASTELLANA, 7, 28046, MADRID",LUB00032,1574
ES0219,"Bank of Africa Europe, S.A.",Entidad de crédito,"Cl Serrano, 59, 28006, Madrid",,219
ES1485,"Bank of America Europe DAC, Sucursal en España",Entidad de crédito,"Cl Marqués de Villamagna, 3, 28020, Madrid",IEMLCMBX,1485
ES1488,BANK PICTET & CIE (EUROPE) AG SUCURSAL EN ESPAÑA,Entidad de crédito,"CL ORTEGA Y GASSET, 29, 28006, MADRID",DE05933,1488
ES8832,"Bankinter Consumer Finance, E.F.C., S.A.",Otra institución,"AV DE BRUSELAS, 12, 28108, ALCOBENDAS",,8832
ES0128,"Bankinter, S.A.",Entidad de crédito,"Ps de la Castellana 29, 28046, Madrid",,128
ES1525,"Banque Chaabi du Maroc, Sucursal en España",Entidad de crédito,"Av del Doctor Arce, 35, 28002, Madrid",FR41439,1525
ES1580,"BANQUE J. SAFRA SARASIN (LUXEMBOURG) SA, SUCURSAL EN ESPAÑA",Entidad de crédito,"Pº DE LA CASTELLANA,13, 28046, MADRID",LUB00148,1580
ES0152,"Barclays Bank Ireland PLC, Sucursal en España",Entidad de crédito,"Cl José Abascal, 51, 28003, Madrid",IEC36964,152
ES1554,"BFF Bank, S.P.A. Sucursal en España",Entidad de crédito,"Ps DE LA CASTELLANA, 81, 28046, Madrid",IT0000464876170,1554
ESA86969607,"BIP&Drive EDE, S.A",Otra institución,"CL SERRANO, 45, 28001, MADRID",,6712
ES1533,"BMW Bank GmbH, Sucursal en España",Entidad de crédito,"Av de Burgos, 118, 28050, Madrid",DE03392,1533
ES6717,"Bnext Electronic Issuer, E.D.E. S.L.",Otra institución,"CL ZURBANO, 71, 28010, MADRID",,6717
ES1532,"BNP Paribas Factor, Sucursal en España",Otra institución,"Cl Emilio Vargas, 4, 28043, Madrid",FR18020,1532
ES1492,BNP Paribas Lease Group S.A. Sucursal en España,Entidad de crédito,"PS DE LOS MELANCÓLICOS, 14A, 28005, MADRID",FR30958,1492
ES0149,"BNP Paribas S.A., Sucursal en España",Entidad de crédito,"Cl Emilio Vargas, 4, 28043, Madrid",FR30004,149
ES1500,"BPCE Lease, Sucursal en España",Entidad de crédito,"Ps Recoletos, 7-9, 28004, Madrid",FR11128,1500
ES1576,"Bunq B.V., Sucursal en España",Entidad de crédito,"CL JOSÉ ABASCAL, 41, 28003, MADRID",NL159,1576
ESW0230061D,"CA AUTO BANK, SPA, SUCURSAL EN ESPAÑA",Entidad de crédito,"AV. DE LA VEGA, 15, 28108, ALCOBENDAS",IT0001863196870,8640
ES1545,"CA Indosuez Wealth (Europe), Sucursal en España",Entidad de crédito,"Pº Castellana, 1, 28046, Madrid",LUB00331,1545
ES0038,"CACEIS Bank Spain, S.A.",Entidad de crédito,"PQ.EMPRESARIAL LA FINCA-P.CLUB DEPORTIVO, 28223, POZUELO DE ALARCON",,38
ES1451,Caisse Régionale de Crédit Agricole Mutuel Sud-Méditerranée (Ariège et Pyrénées-Orientales),Entidad de crédito,"Cl Córcega, 301, 08008, Barcelona",FR17106,1451
ES1493,"Caixa Banco de Investimento, S.A. Sucursal en España",Entidad de crédito,"Cl Caléndula, 93, 28109, Alcobendas",PT25,1493
ES3025,"Caixa de Crédit dels Enginyers- Caja de Crédito de los Ingenieros, S. Coop. de Crédito",Entidad de crédito,"Via Laietana, 39, 08003, Barcelona",,3025
ES3159,"Caixa Popular-Caixa Rural, S. Coop. de Crédito V.",Entidad de crédito,"AV JUAN DE LA CIERVA, 9, 46980, PATERNA",,3159
ES3045,"Caixa Rural Altea, Cooperativa de Crédito Valenciana",Entidad de crédito,"PLACETA DEL CONVENT, 2, 03590, ALTEA",,3045
ES3162,"Caixa Rural Benicarló, S. Coop. de Credit V.",Entidad de crédito,"AV JOAN CARLES I, 18, 12580, BENICARLO",,3162
ES3117,"Caixa Rural D'Algemesí, S. Coop. V. de Crédit",Entidad de crédito,"CL SAN JOSÉ DE CALASANZ, 6, 46680, ALGEMESI",,3117
ES3105,"Caixa Rural de Callosa d'en Sarrià, Cooperativa de Crédito Valenciana",Entidad de crédito,"AV JAIME I, 1, 03510, CALLOSA D'EN SARRIA",,3105
ES3096,"Caixa Rural de L'Alcudia, Sociedad Cooperativa Valenciana de  Crédito",Entidad de crédito,"AV VERGE DE L'ORETO 2, 46250, L' ALCUDIA",,3096
ES3123,"Caixa Rural de Turís, Cooperativa de Crédito Valenciana",Entidad de crédito,"PZ CONSTITUCIÓN, 2, 46389, TURIS",,3123
ES3070,"Caixa Rural Galega, Sociedad Cooperativa de Crédito Limitada Gallega",Entidad de crédito,"Av de Montero Ríos, 24-26, 27002, Lugo",,3070
ES3111,"Caixa Rural La Vall 'San Isidro', Sociedad Cooperativa de Crédito Valenciana",Entidad de crédito,"AV CORAZÓN DE JESÚS, 3, 12600, LA VALL D'UIXO",,3111
ES3166,"Caixa Rural Les Coves de Vinromá, S. Coop. de Crédit V.",Entidad de crédito,"CL SAN ANTONIO, 27, 12185, LES COVES DE VINROMA",,3166
ES3160,"Caixa Rural Sant Josep de Vilavella, S. Coop. de Crédito V.",Entidad de crédito,"CL CUEVA SANTA, 11, 12526, VILABELLA",,3160
ES3102,"Caixa Rural Sant Vicent Ferrer de La Vall D'Uixó, Coop. de Credit V.",Entidad de crédito,"PZ DEL CENTRO, 4, 12600, LA VALL D'UIXO",,3102
ES3118,Caixa Rural Torrent Cooperativa de Credit Valenciana,Entidad de crédito,"AV AL VEDAT, 3, 46900, TORRENT",,3118
ES3174,"Caixa Rural Vinarós, S. Coop. de Credit. V.",Entidad de crédito,"CL SAN CRISTÓBAL, 19, 12500, VINAROS",,3174
ESV63050835,"CAIXABANK MONETARIO RENDIMIENTO, FI",Fondo del mercado monetario,"PASEO CASTELLANA, 189, 28046, MADRID",,FI2680
ES8776,"Caixabank Payments & Consumer, E.F.C., E.P., S.A.",Otra institución,"Cl Caleruega, 102, 28033, Madrid",,8776
ES2100,"Caixabank, S.A.",Entidad de crédito,"Cl Pintor Sorolla 2-4, 46002, Valencia",,2100
ES2045,Caja de Ahorros y Monte de Piedad de Ontinyent,Entidad de crédito,"PZ SANTO DOMINGO, 24, 46870, ONTINYENT",,2045
ES3029,"Caja de Crédito de Petrel, Caja Rural, Cooperativa de Crédito Valenciana",Entidad de crédito,"CL SAN BARTOLOMÉ,2, 03610, PETRER",,3029
ES3035,Caja Laboral Popular Coop. de Crédito,Entidad de crédito,"PS JOSE MARÍA ARIZMENDIARRIETA SN, 20500, ARRASATE/MONDRAGON",,3035
ES3115,"Caja Rural 'Nuestra Madre del Sol', S. Coop. Andaluza de Crédito",Entidad de crédito,"CL ALTO GUADALQUIVIR, 4, 14430, ADAMUZ",,3115
ES3110,"Caja Rural Católico Agraria, S. Coop. de Crédito V.",Entidad de crédito,"PZ MAYOR, 10, 12540, VILA-REAL",,3110
ES3005,"Caja Rural Central, Sociedad Cooperativa de Crédito",Entidad de crédito,"CL JOSÉ MARÍA SARGET 29, 03300, ORIHUELA",,3005
ES3190,"Caja Rural de Albacete, Ciudad Real y Cuenca, Sociedad Cooperativa de Crédito",Entidad de crédito,"Cl Tesifonte Gallego, 18, 02002, Albacete",,3190
ES3150,"Caja Rural de Albal, Coop. de Crédito V.",Entidad de crédito,"PZ DEL JARDÍ, 24, 46470, ALBAL",,3150
ES3179,"Caja Rural de Alginet, Sociedad Cooperativa Crédito Valenciana",Entidad de crédito,"CL VALENCIA 13, 46230, ALGINET",,3179
ES3001,"Caja Rural de Almendralejo, Sociedad Cooperativa de Crédito",Entidad de crédito,"PZ DE SAN ANTONIO, SN, 06200, ALMENDRALEJO",,3001
ES3191,"Caja Rural de Aragón, Sociedad Cooperativa de Crédito",Entidad de crédito,"CI Coso 29, 50003, Zaragoza",,3191
ES3059,"Caja Rural de Asturias, Sociedad Cooperativa de Crédito",Entidad de crédito,"Cl Melquiades Álvarez,7, 33002, Oviedo",,3059
ES3089,Caja Rural de Baena Ntra. Sra. de Guadalupe Sociedad Cooperativa de Crédito Andaluza,Entidad de crédito,"CL  DUQUE DE RIVAS, 3, 14850, BAENA",,3089
ES3060,"Caja Rural de Burgos, Fuentepelayo, Segovia y Castelldans, Sociedad Cooperativa de Crédito",Entidad de crédito,"Cl. LosCoches, 2-4, 40002, Segovia",,3060
ES3104,Caja Rural de Cañete de Las Torres Ntra. Sra. del Campo Sociedad Cooperativa Andaluza de Crédito,Entidad de crédito,"PZA DE ESPAÑA, 5, 14660, CAÑETE DE LAS TORRES",,3104
ES3127,"Caja Rural de Casas Ibáñez, S. Coop. de Crédito de Castilla-La Mancha",Entidad de crédito,"CL TERCIA, 49, 02200, CASAS-IBAÑEZ",,3127
ES3121,"Caja Rural de Cheste, Sociedad Cooperativa de Crédito Valenciana",Entidad de crédito,"PZ DR. CAJAL, 2, 46380, CHESTE",,3121
ES3009,"Caja Rural de Extremadura, Sociedad Cooperativa de Crédito",Entidad de crédito,"Av de Santa Marina 15, 06005, Badajoz",,3009
ES3007,"Caja Rural de Gijón, Sociedad Cooperativa Asturiana de Crédito",Entidad de crédito,"PS DE LA INFANCIA, 10, 33207, GIJON",,3007
ES3023,"Caja Rural de Granada, Sociedad Cooperativa de Crédito",Entidad de crédito,"Av Don Bosco, 2, 18006, Granada",,3023
ES3140,"Caja Rural de Guissona, Sociedad Cooperativa de Crédito",Entidad de crédito,"CL TRASPALAU, 8, 25210, GUISSONA",,3140
ES3067,"Caja Rural de Jaén, Barcelona y Madrid, Sociedad Cooperativa de Crédito",Entidad de crédito,"CL EL CONDADO, 23, 23620, MENGIBAR",,3067
ES3008,"Caja Rural de Navarra, S. Coop. de Crédito",Entidad de crédito,"PZ DE LOS FUEROS, 1, 31003, PAMPLONA/IRUÑA",,3008
ES3098,"Caja Rural de Nueva Carteya,  Sociedad Cooperativa Andaluza de Crédito",Entidad de crédito,"AV ANDALUCÍA, 6, 14857, NUEVA CARTEYA",,3098
ES3016,"Caja Rural de Salamanca, Sociedad Cooperativa de Crédito",Entidad de crédito,"Puerta de Zamora, 2, 37005, Salamanca",,3016
ES3017,"Caja Rural de Soria, Sociedad Cooperativa de Crédito",Entidad de crédito,"Cl Diputación,1, 42003, Soria",,3017
ES3080,"Caja Rural de Teruel, Sociedad Cooperativa de Crédito",Entidad de crédito,"Pz Carlos Castel, 14, 44001, Teruel",,3080
ES3020,"Caja Rural de Utrera, Sociedad Cooperativa Andaluza de Crédito",Entidad de crédito,"PZ DEL ALTOZANO, 22, 41710, UTRERA",,3020
ES3144,"Caja Rural de Villamalea, S. Coop. de Crédito Agrario de Castilla-La Mancha",Entidad de crédito,"PZ DE LA CONCEPCIÓN, 1, 02270, VILLAMALEA",,3144
ES3152,"Caja Rural de Villar, Coop. de Crédito V.",Entidad de crédito,"CL LAS CRUCES 33, 46170, VILLAR DEL ARZOBISPO",,3152
ES3085,"Caja Rural de Zamora, Cooperativa de Crédito",Entidad de crédito,"Av Alfonso IX, 7, 49014, Zamora",,3085
ES3187,"Caja Rural del Sur, S. Coop. de Crédito",Entidad de crédito,"Cl Murillo 2, 41001, Sevilla",,3187
ES3157,"Caja Rural La Junquera de Chilches, S. Coop. de Crédito V.",Entidad de crédito,"PZ DE ESPAÑA, 8, 12592, CHILCHES/XILXES",,3157
ES3134,"Caja Rural Nuestra Señora de la Esperanza de Onda, S. Coop. de Crédito V.",Entidad de crédito,"PZ EL PLÁ, 19, 12200, ONDA",,3134
ES3018,"Caja Rural Regional San Agustín Fuente Álamo Murcia, Sociedad Cooperativa de Crédito",Entidad de crédito,"Gran Vía, 1, 30320, Fuente Álamo",,3018
ES3165,Caja Rural San Isidro de Vilafames S. Coop. de Crédito V.,Entidad de crédito,"AV DE BARCELÓ, 6, 12192, VILAFAMES",,3165
ES3119,Caja Rural San Jaime de Alquerías Niño Perdido S. Coop. de Crédito V.,Entidad de crédito,"CL JAIME CHICHARRO 24, 12539, ALQUERIAS DEL NIÑO PERDIDO",,3119
ES3113,Caja Rural San José de Alcora S. Coop. de Crédito V.,Entidad de crédito,"CL SAN FRANCISCO, 14, 12110, L' ALCORA",,3113
ES3130,"Caja Rural San José de Almassora, S. Coop. de Crédito V.",Entidad de crédito,"CL TRINIDAD, 20, 12550, ALMAZORA/ALMASSORA",,3130
ES3112,"Caja Rural San José de Burriana, S. Coop. de Crédito V.",Entidad de crédito,"PZ EL PLA, 1, 12530, BORRIANA/BURRIANA",,3112
ES3135,Caja Rural San José de Nules S. Coop. de Crédito V.,Entidad de crédito,"CL MAYOR, 66, 12520, NULES",,3135
ES3095,Caja Rural San Roque de Almenara S. Coop. de Crédito  V.,Entidad de crédito,"CL DR. BERENGUER, 4, 12590, ALMENARA",,3095
ES3058,"Cajamar Caja Rural, Sociedad Cooperativa de Crédito",Entidad de crédito,"PZ PUERTA DE ARCHENA, 10, 04001, ALMERÍA",,3058
ES3076,"Cajasiete, Caja Rural, Sociedad Cooperativa de Crédito",Entidad de crédito,"Av Manuel Hermoso Rojas, 8, 38003, Santa Cruz de Tenerife",,3076
ES0237,"Cajasur Banco, S.A.",Entidad de crédito,"AV. GRAN CAPITÁN, 11-13, 14008, CÓRDOBA",,237
ES8844,CASTELO CAPITAL EFC SA,Otra institución,"AVDA DIEGO MARTÍNEZ BARRIO, 4, 41013, SEVILLA",,8844
ES4706,"Caterpillar Financial Corporación Financiera, S.A., E.F.C.",Otra institución,"VÍA DE LAS DOS CASTILLAS, 33, 28224, POZUELO DE ALARCON",,4706
ES0234,"CBNK BANCO DE COLECTIVOS, S.A.",Entidad de crédito,"CL ALMAGRO, 8, 28010, MADRID",,234
ES2000,"Cecabank, S.A.",Entidad de crédito,"Cl Alcalá,27, 28014, Madrid",,2000
ES1553,"China Construction Bank (Europe), S.A., Sucursal en España",Entidad de crédito,"Av. Diagonal, 640, 08017, Barcelona",LUB00375,1553
ES1474,"Citibank Europe Plc, Sucursal en España",Entidad de crédito,"ORTEGA Y GASSET 29, 28006, MADRID",IECITIFS,1474
ES1499,"Claas Financial Services, S.A.S., Sucursal en España",Entidad de crédito,"PS DE LOS MELANCÓLICOS, 14, 28005, MADRID",FR14218,1499
ES1546,"CNH Industrial Capital Europe, S.A.S., Sucursal en España",Entidad de crédito,"PS DE LOS MELANCÓLICOS, 14, 28005, MADRID",FR13838,1546
ES1543,"Cofidis, S.A. Sucursal en España",Entidad de crédito,"PZ DE LA PAU, SN, 08940, CORNELLA DE LLOBREGAT",FR14940,1543
ES2056,Colonya - Caixa D'estalvis de Pollensa,Entidad de crédito,"PZ MAYOR, 7, 07460, POLLENÇA",,2056
ES0159,"Commerzbank Aktiengesellschaft, Sucursal en España",Entidad de crédito,"Ps de la Castellana 259, pl 32, 28046, Madrid",DE00003,159
ES1459,"Cooperatieve Rabobank U.A., Sucursal en España",Entidad de crédito,"Cl Rafael Calvo, 39, 28010, Madrid",NL600,1459
ESA88147053,"CREDIT AGRICOLE CONSUMER FINANCE SPAIN, EFC, S.A.",Otra institución,"AV. MANOTERAS, 44, 28050, MADRID",,8841
ES0154,"Crédit Agricole Corporate and Investment Bank, Sucursal en España",Entidad de crédito,"Ps de la Castellana , 1, 28046, Madrid",FR31489,154
ES1472,"Crédit Agricole Leasing & Factoring, Sucursal en España",Entidad de crédito,"Ps de la Castellana, 1, 28046, Madrid",FR16850,1472
ES1555,"Crédit Mutuel Leasing, Sucursal en España",Entidad de crédito,"PS DE LA CASTELLANA, 42, 28046, MADRID",FR13070,1555
ESA79192258,"Credit Suisse Bank (Europe), S.A.",Entidad de crédito,"CL AYALA, 42 - 3º B, 28001, MADRID",,243
ES6716,"Currencies Direct Spain, EDE, SL",Otra institución,"AV DEL MEDITERRANEO 341, 04638, MOJACAR",,6716
ES8842,"DAIMLER TRUCK FINANCIAL SERVICES ESPAÑA E.F.C., S.A.U.",Otra institución,"AVDA DE BRUSELAS, 30, 28108, ALCOBENDAS",,8842
ES1457,"De Lage Landen International B.V., Sucursal en España",Entidad de crédito,"CL  JOSE BARDASANO BAOS, 9, 28016, MADRID",NL7802,1457
ES1548,"Dell Bank International Designated Activity Company, Sucursal en España",Entidad de crédito,"Cl Ribera del Loira, 8, 28042, Madrid",IEC92019,1548
ES0145,"Deutsche Bank, A.G., Sucursal en España",Entidad de crédito,"Ps de la Castellana, 18, 28046, Madrid",DE00001,145
ES0019,"Deutsche Bank, Sociedad Anónima Española",Entidad de crédito,"Ps de la Castellana, 18, 28046, Madrid",,19
ES8826,"Deutsche Leasing Iberica, E.F.C.,  S.A.",Otra institución,"PZ. EUROPA, 9 Y11, 08908, L' HOSPITALET DE LLOBREGAT",,8826
ES1501,"Deutsche Pfandbriefbank AG, Sucursal en España",Entidad de crédito,"Cl Montesquinza, 30, 28010, Madrid",DE03249,1501
ES0211,"EBN Banco de Negocios, S.A.",Entidad de crédito,"Ps de Recoletos, 29, 28004, Madrid",,211
ES1473,"Edmond de Rothschild (Europe), Sucursal en España",Entidad de crédito,"Ps de la Castellana, 55, 28046, Madrid",LUB00172,1473
ES3081,"Eurocaja Rural, Sociedad Cooperativa de Crédito",Entidad de crédito,"Cl Méjico, 2, 45004, Toledo",,3081
ES0239,Evo Banco S.A.,Entidad de crédito,"Cl Serrano, 45, 28001, Madrid",,239
ES0218,FCE Bank Plc Sucursal en España,Entidad de crédito,"CL CALÉNDULA, 13, 28109, ALCOBENDAS",GB1190,218
ES8308,"Financiera Carrión, S.A., E.F.C.",Otra institución,"Ps del Pintor Rosales, 4, 28008, Madrid",,8308
ES8805,"Financiera El Corte Inglés E.F.C., S.A.",Otra institución,"CL HERMOSILLA, 112, 28009, MADRID",,8805
ES8823,"Financiera española de crédito a distancia, E.F.C., S.A.",Otra institución,"Av Fuente de la Mora, 4, 28050, Madrid",,8823
ES6726,FINOM PAYMENTS SUCURSAL EN ESPAÑA,Otra institución,"PS DE LA CASTELLANA, 141, 28046, MADRID",,6726
ES6718,"FINPAY Entidad de Dineero Electrónico, S.A",Otra institución,"PS DE LA CASTELLANA, 126, 28046, Madrid",,6718
ESV44702165,"FONDO NARANJA MONETARIO, FI",Fondo del mercado monetario,"PASEO CASTELLANA 33, 28046, MADRID",,FI5769
ES8839,"GCC Consumo, EFC, S.A",Otra institución,"Ps de los Melancólicos, 14, 28005, Madrid",,8839
ES1496,"Genefim, Sucursal en España",Entidad de crédito,"Pz Pablo Ruiz Picasso, 1, 28020, Madrid",FR17660,1496
ES6702,"Global Payment Moneytopay, EDE, SL",Otra institución,"AVDA MANOTERAS, 20, 28050, MADRID",,6702
ES1564,"Goldman Sachs Bank Europe SE, Sucursal en España",Entidad de crédito,"Cl María de Molina, 6, 28006, Madrid",DE05602,1564
ES1497,"Haitong Bank, S.A., Sucursal en España",Entidad de crédito,"Ps de la Castellana, 52, 28046, Madrid",PT47,1497
ES1504,"Honda Bank GmbH, Sucursal en España",Entidad de crédito,"CL MAR DEL NORD, 1, 08130, SANTA PERPETUA DE MOGODA",DE05685,1504
ES0162,"HSBC Continental Europe, Sucursal en España",Entidad de crédito,"PZ PABLO RUIZ PICASSO SN PL.33. TORRE PICASSO, 28020, MADRID",FR30056,162
ES2085,"Ibercaja Banco, S.A.",Entidad de crédito,"Pz D. Basilio Paraíso, 2, 50008, Zaragoza",,2085
ES4832,"IBERCAJA SERVICIOS DE FINANCIACIÓN, ESTABLECIMIENTO FINANCIERO DE CRÉDITO, S.A.",Otra institución,"Ps de la Constitución, 4, 50001, Zaragoza",,4832
ES1514,"IC FINANCIAL SERVICES, SUCURSAL EN ESPAÑA",Entidad de crédito,"AVENIDA DE ARAGÓN, 402, 28022, MADRID",FR15448,1514
ES1538,"Industrial and Commercial Bank of China (Europe) S.A., Sucursal en España",Entidad de crédito,"Ps de Recoletos, 12, 28001, Madrid",LUB00348,1538
ES1465,"Ing Bank, N.V. Sucursal en España",Entidad de crédito,"VÍA DE LOS POBLADOS, 1F Y 1E, 28033, Madrid",NL163,1465
ES1000,Instituto de Crédito Oficial,Entidad de crédito,"Ps del Prado, 4, 28014, Madrid",,1000
ES1494,"Intesa Sanpaolo S.p.A., Sucursal en España",Entidad de crédito,"Pº de Castellana, 31, 28046, Madrid",IT0000101262255,1494
ES1567,"J.P. MORGAN SE, SUCURSAL EN ESPAÑA",Entidad de crédito,"PS DE LA CASTELLANA, 31, 28046, MADRID",DE03991,1567
ES1482,"John Deere Bank, S.A., Sucursal en España",Entidad de crédito,"BL JOHN DEERE, 2, 28984, PARLA",LUB00317,1482
ES0151,"JPMorgan Chase Bank National Association, Sucursal en España",Entidad de crédito,"Ps Castellana, 31, 28045, Madrid",US0ECBM00033,151
ESV56602477,"KUTXABANK MONETARIO AHORRO, FI",Fondo del mercado monetario,"PLAZA DE EUSKADI, NUMERO 5, PLANTA 27, 48009, BILBAO",,FI5824
ES2095,"Kutxabank, S.A.",Entidad de crédito,"CL GRAN VÍA, 30-32, 48009, BILBAO",,2095
ES1547,"Lombard Odier (Europe), S.A., Sucursal en España",Entidad de crédito,"PS DE LA CASTELLANA, 66, 28046, MADRID",LUB00370,1547
ES8342,Luzaro E.F.C. S.A,Otra institución,"AV LIBERTAD, 10, 20004, DONOSTIA/SAN SEBASTIAN",,8342
ES6725,MANGOPAY SA SUCURSAL EN ESPAÑA,Otra institución,"CL FRANCISCO SILVELA, 72, 28028, MADRID",LUW00005,6725
ES1520,"Mediobanca, Sucursal en España",Entidad de crédito,"Cl Jorge Manrique, 12, 28006, Madrid",IT0000101249233,1520
ES4799,"Mercedes-Benz Financial Services España E.F.C., S.A.",Otra institución,"AV DE BRUSELAS, 30, 28108, ALCOBENDAS",,4799
ES1552,"Mirabaud & Cie (Europe) S.A., Sucursal en España",Entidad de crédito,"CI Fortuny, 6, 28010, Madrid",LUB00381,1552
ESA06302657,"MIRALTA FINANCE BANK, S.A.",Entidad de crédito,"PLAZA MANUEL GOMEZ MORENO, 2, 28020, MADRID",,244
ES1559,"Mizuho Bank Europe N.V., Sucursal en España",Entidad de crédito,"Cl Orense, 34, 28020, Madrid",NL530,1559
ES6723,"MODULR FINANCE B.V., SUCURSAL EN ESPAÑA",Otra institución,"CL GRAN VIA DE LES CORTS CATALANES 583, 08011, BARCELONA",,6723
ES6720,"Moneycorp Technologies Limited, S.E",Otra institución,"CL NÚÑEZ DE BALBOA 35, 28001, Madrid",IECBI00184118,6720
ES0160,"MUFG Bank (Europe) N.V., Sucursal en España",Entidad de crédito,"Cl José Ortega y Gasset, 29, 28006, Madrid",NL512,160
ESV85567659,"Mutuafondo Dinero, FI",Fondo del mercado monetario,"PASEO CASTELLANA 33, 28046, Madrid",,FI4082
ES1544,"MYINVESTOR BANCO, S.A.",Entidad de crédito,"CL COLUMELA, 8, 28001, MADRID",,1544
ES1563,"N26 BANK AG, SUCURSAL EN ESPAÑA",Entidad de crédito,"CL JOSÉ ABASCAL, 41, 28003, MADRID",DE05889,1563
ES1479,"Natixis, S.A., Sucursal en España",Entidad de crédito,"Cl Serrano, 90, 28004, Madrid",FR30007,1479
ES0133,"Nuevo Micro Bank, S.A.",Entidad de crédito,"CI ADUANA, 18, 28013, MADRID",,133
ES8235,"OCCIDENT HIPOTECARIA, EFC S.A",Otra institución,"AV SABINO ARANDA, 20, 48013, BILBAO",,8235
ES1577,"Oddo BHF SCA, Sucursal en España",Entidad de crédito,"CL MAJORAL, 17, 28050, MADRID",FR45850,1577
ES8814,"Oney Servicios Financieros, E.F.C., S.A.",Otra institución,"Via de los Poblados, 1, 28033, Madrid",,8814
ES0073,"Open Bank, S.A.",Entidad de crédito,"PLAZA DE SANTA BARBARA, 2, 28004, Madrid",,73
ES1568,"Orange Bank, S.A., Sucursal en España",Entidad de crédito,"Ps Club Deportivo, 1, 28223, Madrid",FR18370,1568
ESA85424893,OUTPAYCE SA,Otra institución,"SALVADOR DE MADARIAGA, 1, 28027, MADRID",,6727
ES6722,"PAGONXT EMONEY EDE, S.L.",Otra institución,"AVDA CANTABRIA S/N, 28660, BOADILLA DEL MONTE",,6722
ESW0284391J,PAYMENTSENSE IRELAND LIMITED SUCURSAL EN ESPAÑA,Otra institución,"PS DE LA CASTELLANA, 259, 28046, MADRID",,6728
ES6707,Pecunia Cards E.D.E. S.L,Otra institución,"AVDA DE BRUSELAS, 35, 28108, ALCOBENDAS",,6707
ES1508,"RCI Banque, S.A., Sucursal en España",Entidad de crédito,"AV. DE EUROPA, 1, 28108, ALCOBENDAS",FR11188,1508
ES0083,"Renta 4 Banco, S.A.",Entidad de crédito,"Ps de la Habana, 74, 28036, Madrid",,83
ES1583,REVOLUT BANK UAB SUCURSAL EN ESPAÑA,Entidad de crédito,"CL PRÍNCIPE DE VERGARA, 132, 28002, MADRID",LT304580906,1583
ES1584,RIVERBANK SA SUCURSAL EN ESPAÑA,Entidad de crédito,"CL BOTIGUERS, 3, 46988, PATERNA",,1584
ES3138,"Ruralnostra, Sociedad Cooperativa de Crédito Valenciana",Entidad de crédito,"PZ MAYOR, 2, 12549, BETXI",,3138
ES0242,"Sabadell Consumer Finance, S.A.",Entidad de crédito,"CL SENA, 12, 08190, SANT CUGAT DEL VALLES",,242
ES0224,"Santander Consumer Finance, S.A.",Entidad de crédito,"Av de Cantabria, sn, 28660, Boadilla del Monte",,224
ES8906,"Santander Factoring y Confirming, S.A., E.F.C.",Otra institución,"AV CANTABRIA, SN, 28660, BOADILLA DEL MONTE",,8906
ES0036,"Santander Investment, S.A.",Entidad de crédito,"AV DE CANTABRIA, SN, 28660, BOADILLA DEL MONTE",,36
ES4797,"Santander Lease, S.A. EFC",Otra institución,"AV DE CANTABRIA, SN, 28660, BOADILLA DEL MONTE",,4797
ESA09641549,"SANTANDER MAPFRE HIPOTECA INVERSA, E.F.C., SA",Otra institución,"CL JUAN IGNACIO LUCA DE TENA, 11, 28027, MADRID",,8845
